{
  "accelerator_backend": "metal",
  "aliases": [
    "m3 max 96gb"
  ],
  "family": "m3-max",
  "id": "apple-m3-max-96gb",
  "kind": "unified",
  "memory": {
    "bandwidth_gb_per_s": {
      "max": 400,
      "min": 300
    },
    "cpu_memory_gb": 96,
    "vram_gb": 96,
    "vram_type": "unified"
  },
  "name": "Apple M3 Max 96GB",
  "products": [
    "MacBook Pro"
  ],
  "schema_version": "local-ai-registry/v1",
  "sources": [
    {
      "kind": "vendor",
      "url": "https://support.apple.com/specs/mac"
    }
  ],
  "vendor": "apple"
}
