{
  "accelerator_backend": "metal",
  "aliases": [
    "m3 24gb"
  ],
  "family": "m3",
  "id": "apple-m3-24gb",
  "kind": "unified",
  "memory": {
    "bandwidth_gb_per_s": 100,
    "cpu_memory_gb": 24,
    "vram_gb": 24,
    "vram_type": "unified"
  },
  "name": "Apple M3 24GB",
  "products": [
    "MacBook Air",
    "MacBook Pro",
    "iMac"
  ],
  "schema_version": "local-ai-registry/v1",
  "sources": [
    {
      "kind": "vendor",
      "url": "https://support.apple.com/specs/mac"
    }
  ],
  "vendor": "apple"
}
